3116,24-10-2024 14:21,24-10-2024 14:28,64,1,5,11,1,1,1,0,0,1,0,1,0,1,0,1,0,0,1,5,5,5,4,5,5,9,I like the organic part.,It's low alcohol content,2,Keystone,Be Ella,,,1163,0
3118,24-10-2024 14:20,24-10-2024 14:29,44,2,5,11,1,1,0,0,0,0,0,1,1,1,1,1,0,1,0,5,5,5,4,5,5,9,It looks refreshing. It’s got a nice label.,I don’t know how it’s so different from the regular ultra and it’s expensive,1,,,,,1163,0
3124,24-10-2024 13:59,24-10-2024 14:31,37,1,5,11,1,1,1,1,0,1,1,1,1,1,0,1,0,0,0,5,5,5,4,5,5,9,That it is homegrown and free of artificial flavors and colors,There is nothing that I dislike,3,Heiniken,Corona,Bud Light,,1163,0
3148,24-10-2024 14:23,24-10-2024 14:52,44,1,5,11,1,1,0,1,0,1,1,1,0,1,0,1,1,1,0,5,5,5,4,5,5,9,I like the packaging. I like the shape of the bottle.,I don't see anything I disliked.,1,,,,,1163,0
3149,24-10-2024 14:41,24-10-2024 14:52,39,2,5,11,1,1,0,1,0,0,1,1,1,1,1,1,1,1,0,5,5,5,4,5,5,9,Low cal options,Nothing exciting,1,,,,,1163,0
3153,24-10-2024 14:36,24-10-2024 14:56,46,2,5,11,1,0,0,0,0,0,0,1,1,1,0,0,0,0,0,5,5,5,4,5,5,9,I like the bottle,Nothing,2,Bud light,Corona,Coors,,1163,1
3154,24-10-2024 14:50,24-10-2024 14:59,55,1,5,11,1,0,0,0,0,1,1,1,1,1,0,1,1,1,0,5,5,5,4,5,5,9,Michelob Ultra is a good brand,Too high a price for a simple light beer,1,,,,,1163,0
3155,24-10-2024 14:18,24-10-2024 15:03,56,2,5,11,1,1,0,0,0,1,1,1,0,0,0,1,1,1,0,5,5,5,4,5,5,9,I like that it's organic and I also like the flavor of Michelob beer,I usually drink a polar bear not so light,2,Budweiser,Corona,Michelob,,1163,0
3213,24-10-2024 17:22,24-10-2024 17:33,56,2,5,11,1,0,0,0,0,1,1,1,0,1,0,0,0,0,0,5,5,5,4,5,5,9,Lower in carbs but the price is competitive,The alcohol content,1,,,,,1163,0
