846,21-10-2024 05:40,21-10-2024 05:52,37,2,5,11,1,0,0,1,0,0,0,0,1,1,0,0,0,0,0,5,5,5,4,5,5,9,It comes from a brand I feel is good and I trust.,There is nothing I dislike about it right now.,2,Budweiser Select,Michelob Ultra,Bud Light,,1163,0
847,21-10-2024 05:41,21-10-2024 05:56,53,1,5,11,1,0,0,0,0,0,0,1,0,1,0,0,0,0,0,5,5,5,4,5,5,9,I don't like anything about it,I don't like anything about it,1,,,,,1163,0
892,21-10-2024 13:52,21-10-2024 14:04,47,2,5,11,1,1,1,1,1,1,1,1,1,1,1,1,1,1,0,5,5,5,4,5,5,9,The packaging is amazing and looks premium and the beer looks so refreshing and amazing,There is nothing to dislike,3,Michelob Ultra,Bud light seltzer,Corona,,1163,0
893,21-10-2024 13:59,21-10-2024 14:07,40,1,5,11,1,1,0,0,0,1,1,1,1,1,0,1,1,1,0,5,5,5,4,5,5,9,It is something different and unique to me.,The price is a little high for what it is.,2,Corona,Busch,Bud light,,1163,0
903,21-10-2024 14:21,21-10-2024 14:33,56,1,5,11,1,0,0,0,0,0,0,0,0,1,0,0,0,0,0,5,5,5,4,5,5,9,I don't know,I don't know,1,,,,,1163,0
911,21-10-2024 14:53,21-10-2024 15:02,58,2,5,11,1,1,0,1,1,1,1,1,1,1,1,1,1,1,0,5,5,5,4,5,5,9,It is one I am familar with and my family likes.,Nothing,2,Budweiser,Corona,Heineken,,1163,0
934,21-10-2024 17:31,21-10-2024 17:43,60,1,5,11,1,0,0,0,0,0,0,1,1,1,1,0,0,1,0,5,5,5,4,5,5,9,Low carbs,Nothing,2,Miller lite,Stella,Michelob ultra,,1163,0
953,21-10-2024 18:08,21-10-2024 18:30,42,1,5,11,1,1,0,1,0,1,1,1,1,1,0,1,1,1,0,5,5,5,4,5,5,9,It's a really good brand that I trust.,Nothing really,1,,,,,1163,0
954,21-10-2024 18:29,21-10-2024 18:34,38,2,5,11,1,1,0,1,1,1,0,0,1,1,0,1,0,1,0,5,5,5,4,5,5,9,No,No,1,,,,,1163,0
958,21-10-2024 18:39,21-10-2024 18:53,55,1,5,11,1,0,0,0,0,0,0,1,1,0,0,0,0,0,0,5,5,5,4,5,5,9,Less calories maybe. I don’t dislike it just not my preference,Nothing,1,,,,,1163,0
966,21-10-2024 18:54,21-10-2024 19:14,29,2,5,11,1,1,1,1,0,0,1,1,1,1,1,1,1,0,1,5,5,5,4,5,5,9,Light beer with crispy taste,Nothing to dislike,2,Heineken,Busch,Bud light,,1163,0
970,21-10-2024 19:11,21-10-2024 19:25,64,1,5,11,1,1,1,1,0,1,1,1,1,1,0,1,0,1,1,5,5,5,4,5,5,9,High quality beer for not that expensive of price,Not really anything to be honest,1,,,,,1163,0
976,21-10-2024 19:33,21-10-2024 19:40,50,2,5,11,1,0,0,0,0,1,0,1,0,0,1,1,0,0,0,5,5,5,4,5,5,9,Flavor,Nothing,2,,,,,1163,1
979,21-10-2024 19:35,21-10-2024 19:55,58,2,5,11,1,0,0,0,0,1,0,0,1,1,0,1,0,0,0,5,5,5,4,5,5,9,"IT IS CRISP AND REFRESHING. IT HAS GREAT TASTE AND NO ARTIFICAL  COLORS OT FLAVORS, IT IS A LIGHT ORGANIC BEER",NOTHING IS DISLIKED,1,,,,,1163,0
984,21-10-2024 19:51,21-10-2024 20:10,65,1,5,11,1,0,0,0,0,1,0,1,0,1,0,1,0,0,0,5,5,5,4,5,5,9,It’s got a good color,Budweiser products tend to have weak tastes,2,Michelob Ultra,Miller Lite,Bud Light,,1163,0
1001,21-10-2024 19:56,21-10-2024 20:37,62,2,5,11,1,0,0,0,0,0,0,1,0,1,0,0,0,1,0,5,5,5,4,5,5,9,The name Pure Gold,Extra Light,1,,,,,1163,0
1006,21-10-2024 20:24,21-10-2024 20:42,56,1,5,11,1,0,0,0,0,1,0,1,0,1,0,1,1,1,0,5,5,5,4,5,5,9,The taste/flavor it has,Doesn't always quench my thirst when having spicy foods,1,,,,,1163,0
1009,21-10-2024 20:40,21-10-2024 20:48,31,2,5,11,1,0,0,1,0,0,0,1,1,0,0,0,0,0,0,5,5,5,4,5,5,9,I like the designa,Nothing,2,Bud light,Cororna,Coors light,,1163,0
1011,21-10-2024 20:36,21-10-2024 20:50,26,2,5,11,1,0,0,0,0,0,0,0,0,0,0,0,1,0,0,5,5,5,4,5,5,9,The smooth taste,It’s very hard to find where I reside they sell out very fast,3,Budweiser,Mescato Wine,Dos XX,,1163,0
1014,21-10-2024 20:43,21-10-2024 20:58,56,2,5,11,1,0,0,0,0,0,0,1,1,1,0,1,0,0,0,5,5,5,4,5,5,9,It's a premium beer. I light the packaging to.,Nothing,3,Busch light,Coors light,Miller light,,1163,0
1047,21-10-2024 22:53,21-10-2024 23:03,63,2,5,11,1,0,0,0,0,1,0,1,0,1,0,0,1,1,0,5,5,5,4,5,5,9,Very smooth taste and flavor,Nothing like it very much,2,Miller High Life,Bud light,Corona,,1163,0
1055,21-10-2024 23:01,21-10-2024 23:29,21,2,5,11,1,0,0,1,0,0,1,1,0,1,0,0,0,0,0,5,5,5,4,5,5,9,I have never drank it so I can't say,Nothing to say because I've never drank it,1,,,,,1163,0
1072,22-10-2024 00:12,22-10-2024 00:22,41,2,5,11,1,0,0,0,0,0,0,1,0,1,0,0,0,0,0,5,5,5,4,5,5,9,low calories,taste,1,,,,,1163,0
1084,22-10-2024 00:40,22-10-2024 00:56,45,2,5,11,1,0,0,0,0,1,0,0,0,1,0,0,0,0,0,5,5,5,4,5,5,9,Low calorie and the price being average,Can’t think of snything,1,,,,,1163,1
1093,22-10-2024 01:52,22-10-2024 02:01,34,2,5,11,1,1,0,1,0,1,1,1,1,1,1,0,1,0,1,5,5,5,4,5,5,9,Looks like it would taste really good,Nothing much really,1,,,,,1163,0
1095,22-10-2024 02:05,22-10-2024 02:12,27,1,5,11,1,1,0,0,0,0,1,1,0,1,1,1,1,0,0,5,5,5,4,5,5,9,i want to try it before i say i like it.,nothing yet,1,,,,,1163,0
1098,22-10-2024 02:07,22-10-2024 02:19,34,2,5,11,1,0,0,0,0,1,0,1,0,1,0,0,0,1,0,5,5,5,4,5,5,9,I think it would taste better because it's organic,I feel like it might be more expensive,2,hurricane,steel reserve,coors light,,1163,0
1112,22-10-2024 03:56,22-10-2024 04:05,54,2,5,11,1,0,0,0,0,0,0,0,1,0,0,0,0,0,0,5,5,5,4,5,5,9,Nothing,Everything,1,,,,,1163,0
1113,22-10-2024 03:56,22-10-2024 04:13,48,1,5,11,1,1,0,0,0,1,0,0,0,1,0,1,0,0,0,5,5,5,4,5,5,9,i like it very much,i dont like the color,2,food,apple,gold,,1163,0
1124,22-10-2024 04:36,22-10-2024 04:46,39,1,5,11,1,1,0,1,0,1,1,1,1,0,0,0,1,1,0,5,5,5,4,5,5,9,i like it very much,nothing,2,bud light,beer,vodka,,1163,0
1130,22-10-2024 04:41,22-10-2024 04:55,36,1,5,11,1,1,0,0,0,1,0,0,1,1,0,0,1,0,0,5,5,5,4,5,5,9,I like the smoothness of the product,I dont dislike it,1,,,,,1163,0
1141,22-10-2024 05:00,22-10-2024 05:11,63,1,5,11,1,0,0,0,0,0,0,1,1,1,0,0,0,0,0,5,5,5,4,5,5,9,"I like the it's organic, made in the USA, and there are no artificial ingredients.",It's very light and light on alcohol.,2,Miller Geniune Draft,Miller Light,Coor Lite,,1163,0
1169,22-10-2024 06:32,22-10-2024 06:54,39,1,5,11,1,1,1,1,1,1,1,1,1,1,1,1,1,0,1,5,5,5,4,5,5,9,it is good for best,nothing to say,3,good,great,nice,,1163,0
1190,22-10-2024 07:57,22-10-2024 08:08,37,1,5,11,1,1,1,0,0,1,1,0,1,1,0,1,0,0,0,5,5,5,4,5,5,9,This is very unique,No dislike all good,3,light lager,Anheuser Busch,Michelob,,1163,0
1192,22-10-2024 08:00,22-10-2024 08:16,65,2,5,11,1,0,0,0,0,1,0,1,0,1,0,0,0,0,0,5,5,5,4,5,5,9,Organic ingredients.,Normal stuff.,2,Michelob Golden,Coors,Pabst,,1163,0
1205,22-10-2024 09:04,22-10-2024 09:12,37,1,5,11,1,0,0,0,0,0,0,1,0,0,0,1,0,1,0,5,5,5,4,5,5,9,A refreshing drink full of flavor,Just a little weak in alcohol volume,2,Coors,Miller lite,Non alcoholic drink,,1163,0
1213,22-10-2024 09:40,22-10-2024 10:01,26,1,5,11,1,1,0,1,0,1,1,1,1,1,0,1,1,1,0,5,5,5,4,5,5,9,It seems like it would be a light and crisp taste,Not a lot of alcohol,2,Michlob Ultra,Miller Lite,Bucsh Light,,1163,0
1225,22-10-2024 10:29,22-10-2024 10:38,48,2,5,11,1,0,0,0,0,1,0,0,0,1,0,0,0,0,0,5,5,5,4,5,5,9,Nothing in particular,Nothing in particular,1,,,,,1163,1
1226,22-10-2024 10:37,22-10-2024 10:52,60,1,5,11,1,0,0,0,0,1,0,1,0,1,0,0,1,1,0,5,5,5,4,5,5,9,pretty color and packaging,the flavor of all their other products dissuades me from spending money on this,1,,,,,1163,0
1227,22-10-2024 10:43,22-10-2024 10:52,31,1,5,11,1,1,1,0,1,0,0,1,1,1,0,0,1,0,0,5,5,5,4,5,5,9,its only has 85 calories,its 9.99 for 6pk,3,hieniken,busch,none,,1163,0
1240,22-10-2024 11:21,22-10-2024 11:35,49,2,5,11,1,0,0,0,0,1,1,0,1,0,0,0,0,0,0,5,5,5,4,5,5,9,That it's different new and looks good,There is nothing really to not like,1,,,,,1163,1
1241,22-10-2024 11:24,22-10-2024 11:37,41,2,5,11,1,0,0,1,0,1,1,1,0,1,0,1,1,1,0,5,5,5,4,5,5,9,I like that it's a better option for you that doesn't sacrifice taste.,There's nothing to dislike about it.,2,Samuel Adams,Stella,Coors,,1163,0
1243,22-10-2024 11:27,22-10-2024 11:40,55,2,5,11,1,0,0,0,0,0,1,1,0,1,0,0,0,1,0,5,5,5,4,5,5,9,A crisp refreshing experience.,,2,Bud light,Miller light,Colors lught,,1163,0
1247,22-10-2024 11:40,22-10-2024 11:49,62,2,5,11,1,1,0,0,0,0,0,0,0,1,0,0,0,0,0,5,5,5,4,5,5,9,Nothing never drunk it,Nothing never drunk it,1,,,,,1163,0
1248,22-10-2024 11:45,22-10-2024 11:50,41,1,5,11,1,1,1,1,1,1,1,1,0,1,1,1,1,1,1,5,5,5,4,5,5,9,MICHELOB ULTRA HAS RICH AUTHENTIC FLAVOR THAT ABSOLUTELY INTRIGUES ME,RICH IN CALORIES i NEED TO WORK OUT,3,BUD LIGHT,STELL ARTOIS,WHITE CLAW,,1163,0
1256,22-10-2024 11:47,22-10-2024 12:11,35,1,5,11,1,1,0,1,0,1,1,1,1,1,1,1,0,0,0,5,5,5,4,5,5,9,i like it a lot,none,3,corona,budweirse,lig,,1163,0
1258,22-10-2024 12:05,22-10-2024 12:14,34,2,5,11,1,1,0,1,0,0,1,1,1,1,1,0,1,0,1,5,5,5,4,5,5,9,The low carb benefit,Not sure if it would be as good because of very low alcohol content,2,Michelob ultra,Bud light,Coors,,1163,0
1260,22-10-2024 12:14,22-10-2024 12:22,40,2,5,11,1,1,1,1,1,1,1,1,1,1,1,1,1,1,1,5,5,5,4,5,5,9,Awesome love it tasty and delicious,I'm not sure nothing,1,,,,,1163,0
1261,22-10-2024 12:29,22-10-2024 12:40,61,1,5,11,1,0,0,0,0,0,0,0,1,0,0,0,0,0,0,5,5,5,4,5,5,9,Light beer with refreshing taste,Nothing,1,,,,,1163,0
1270,22-10-2024 13:28,22-10-2024 13:55,34,1,5,11,1,0,1,1,1,1,1,1,1,1,1,1,1,0,1,5,5,5,4,5,5,9,Nice,,3,,Nonr,N,,1163,0
1271,22-10-2024 13:44,22-10-2024 13:57,47,1,5,11,1,1,0,0,0,1,1,1,0,1,0,0,0,0,0,5,5,5,4,5,5,9,It's high alcohol content,It's price,1,,,,,1163,0
1275,22-10-2024 14:04,22-10-2024 14:13,40,2,5,11,1,0,0,1,0,1,0,0,1,1,0,0,1,0,0,5,5,5,4,5,5,9,I would like the flavor,The flavor,1,,,,,1163,0
1283,22-10-2024 14:51,22-10-2024 14:59,51,1,5,11,1,0,0,0,0,0,0,1,1,0,0,0,0,0,0,5,5,5,4,5,5,9,85 calories,Most beer drinkers don't care if alcohol is organic.,1,,,,,1163,1
1284,22-10-2024 14:57,22-10-2024 15:06,54,2,5,11,1,0,0,0,0,1,0,0,1,0,1,0,1,0,0,5,5,5,4,5,5,9,No comment,No comment,1,,,,,1163,0
1286,22-10-2024 15:01,22-10-2024 15:14,38,1,5,11,1,1,0,1,0,1,1,1,0,1,0,0,1,1,0,5,5,5,4,5,5,9,The price for a 6 pack,Only 3.8% alcohol,2,Bud light,Milwaukee Best,Michelob ultra regular,,1163,0
1287,22-10-2024 14:59,22-10-2024 15:20,35,2,5,11,1,1,1,1,0,1,1,1,1,1,1,1,1,0,1,5,5,5,4,5,5,9,everything appealing,none,3,nice,like it,the best,,1163,0
1296,22-10-2024 15:36,22-10-2024 15:52,52,2,5,11,1,0,0,0,0,0,0,0,1,0,0,0,1,1,0,5,5,5,4,5,5,9,Less calories,Less alcohol,1,,,,,1163,0
1307,22-10-2024 16:17,22-10-2024 16:33,35,2,5,11,1,0,0,0,0,0,0,0,0,1,0,0,0,0,0,5,5,5,4,5,5,9,Nothing because I don’t like/drink it,It don’t look good at all,3,Necklace,Ring,Earting,,1163,0
1324,22-10-2024 17:31,22-10-2024 17:44,40,1,5,11,1,0,0,0,0,1,0,1,0,1,0,1,1,1,0,5,5,5,4,5,5,9,if you wanted a low ABV beer i guess this would be okay,the alcohol content is just too low,1,,,,,1163,0
1340,22-10-2024 18:40,22-10-2024 18:59,63,1,5,11,1,0,0,0,0,0,0,0,1,0,0,0,0,0,0,5,5,5,4,5,5,9,The bottle and the coloring,Nothing,3,Budweiser,Coors,Corina,,1163,0
1355,22-10-2024 19:27,22-10-2024 19:36,65,1,5,11,1,0,0,0,0,0,0,1,0,1,0,0,0,0,0,5,5,5,4,5,5,9,Organic form,Light lager,1,,,,,1163,0
1357,22-10-2024 18:43,22-10-2024 19:38,63,2,5,11,1,0,0,0,0,0,0,1,0,0,0,0,1,0,0,5,5,5,4,5,5,9,Organic is appealing,nothing comes to mind,2,Corona Premier,Vodka,Tequila,,1163,0
1364,22-10-2024 19:50,22-10-2024 19:57,42,2,5,11,1,0,0,0,0,1,0,1,0,0,0,1,1,0,0,5,5,5,4,5,5,9,Nothing,Everything,1,,,,,1163,0
1373,22-10-2024 19:46,22-10-2024 20:08,46,2,5,11,1,0,0,0,0,0,0,1,1,0,1,0,1,0,0,5,5,5,4,5,5,9,The amount of carbs and calories are the most appealing to me.,"The color gold and the word make me think if Miller for some reason, that steers me away.",1,,,,,1163,1
1382,22-10-2024 20:20,22-10-2024 20:31,55,1,5,11,1,0,0,1,0,1,0,0,0,1,0,1,1,0,0,5,5,5,4,5,5,9,Low carb,The taste,2,Michelob light,Coord light,Bush,,1163,0
1385,22-10-2024 20:33,22-10-2024 20:38,29,1,5,11,1,0,0,1,0,0,1,1,1,0,0,1,1,0,0,5,5,5,4,5,5,9,The low alcohol percent and price does the trick,Nothing at all,2,Miller Lite,Budlight,Miller,,1163,0
1386,22-10-2024 20:22,22-10-2024 20:42,64,2,5,11,1,0,0,0,0,0,0,0,0,0,1,0,0,0,0,5,5,5,4,5,5,9,The taste,Nothing,3,Bud light,Bush light,Natural  light,,1163,0
1393,22-10-2024 21:31,22-10-2024 21:48,48,2,5,11,1,0,0,0,0,1,0,1,0,1,0,1,0,0,0,5,5,5,4,5,5,9,I like that is crisp and made with home grown ingredients,I dislike light low calorie beer,1,,,,,1163,1
1405,22-10-2024 22:37,22-10-2024 22:54,60,2,5,11,1,0,0,1,0,1,0,1,1,1,0,1,0,0,0,5,5,5,4,5,5,9,It has only 85 calories,The price is to much,1,,,,,1163,0
1408,22-10-2024 22:51,22-10-2024 23:00,29,2,5,11,1,1,0,0,0,1,1,1,0,1,0,1,1,0,0,5,5,5,4,5,5,9,It might interest me to buy it when I am in the mood for something light. A low alcoholic drink would be perfect,The bottle isn’t too appealing. If I were looking for this in the store it would be hard to find because it doesn’t stand out as much with it’s packaging,1,,,,,1163,0
1409,22-10-2024 22:51,22-10-2024 23:01,45,2,5,11,1,0,0,0,0,0,0,0,1,0,1,0,0,0,0,5,5,5,4,5,5,9,It's a low carb beer,I've tried it and don't like the flavor,1,,,,,1163,1
1416,23-10-2024 01:39,23-10-2024 01:44,30,1,5,11,1,0,0,1,0,1,1,0,1,1,0,0,0,0,0,5,5,5,4,5,5,9,clean and slick look,a bit too simple,3,cool,modern,interesting,,1163,0
1417,23-10-2024 01:27,23-10-2024 01:45,44,1,5,11,1,0,0,0,0,0,1,0,1,0,0,1,1,1,0,5,5,5,4,5,5,9,I like that it's 1/3 less alcohol not completely none alcoholic.,Nothing really. Maybe could be $1-2 cheaper.,2,White claw,Mikes harder,Busch light,,1163,1
1441,23-10-2024 07:01,23-10-2024 07:09,63,1,5,11,1,0,0,1,0,0,0,0,0,0,0,0,0,1,0,5,5,5,4,5,5,9,Premium beer with lower calories at a good price,Nothing - all sounds great,1,,,,,1163,0
1450,23-10-2024 07:19,23-10-2024 07:30,63,1,5,11,1,0,0,0,0,0,0,0,1,0,0,0,0,0,0,5,5,5,4,5,5,9,The only thing that I like is that it's a light beer.,I never cared for the taste of Michelob,1,,,,,1163,0
1466,23-10-2024 09:32,23-10-2024 09:40,65,1,5,11,1,0,0,0,0,1,0,0,1,0,1,0,0,0,0,5,5,5,4,5,5,9,I like the Ultra brand,Nothing,2,Regular Michelob Ultra,Coors Light,Michelob,,1163,0
1475,23-10-2024 10:18,23-10-2024 10:28,35,2,5,11,1,0,0,0,0,0,0,0,0,1,0,1,0,0,0,5,5,5,4,5,5,9,I like the lower calorie count.,I don't know if I would like this beer.,2,Blue Moon,Summer Shandy,Budlight,,1163,0
1485,23-10-2024 11:44,23-10-2024 11:55,59,2,5,11,1,1,1,1,0,1,1,1,1,1,0,1,0,1,1,5,5,5,4,5,5,9,Organic American products,Price,2,Heineken silver,Coors light,Bud light,,1163,0
1489,23-10-2024 11:51,23-10-2024 12:05,52,2,5,11,1,1,0,0,0,1,0,0,0,1,0,0,0,0,0,5,5,5,4,5,5,9,Nothing,Low alcohol,1,,,,,1163,0
1490,15-10-2024 23:11,15-10-2024 23:19,34,1,5,11,1,1,0,0,0,1,1,0,1,0,1,1,0,0,0,5,5,5,4,5,5,9,ULTRA is my favorite is so good,Is so good and better than the one you decide,3,Amazon,Wolmat,Target,,1163,0
1501,18-10-2024 06:11,18-10-2024 06:21,53,1,5,11,1,1,0,0,0,0,1,0,0,0,0,1,1,0,0,5,5,5,4,5,5,9,It's a light beer with low calories,I am not sure until I taste it,2,Corona light,,,,1163,0
1525,13-10-2024 11:57,13-10-2024 12:13,21,2,5,11,1,1,0,1,1,1,1,1,1,1,1,1,1,0,0,5,5,5,4,5,5,9,I like how it taste.,it not a pretty color.,2,bud light,carna,sweep jucie,,1163,0
1539,22-10-2024 03:02,22-10-2024 03:13,40,1,5,11,1,0,0,0,0,0,0,1,1,0,0,0,0,0,0,5,5,5,4,5,5,9,It's a different beer,It's too much of a stray from the original,1,,,,,1163,0
1577,11-10-2024 11:26,11-10-2024 11:52,29,2,5,11,1,1,0,1,1,1,1,1,1,1,1,1,1,0,0,5,5,5,4,5,5,9,Its made with quality American ingredients,Nothing,1,,,,,1163,0
1608,22-10-2024 01:15,22-10-2024 01:26,40,1,5,11,1,1,1,1,1,1,1,1,1,1,1,1,1,1,1,5,5,5,4,5,5,9,It's very sweet and good for heath,It's very expensive,1,,,,,1163,0
1612,23-10-2024 05:20,23-10-2024 05:34,60,1,5,11,1,0,0,0,0,0,1,1,1,1,0,0,0,0,0,5,5,5,4,5,5,9,Premium organic ingredients,10 bucks for six pack is more that I want to spend.,1,,,,,1163,0
1620,22-10-2024 15:42,22-10-2024 16:09,60,1,5,11,1,0,0,0,0,0,1,0,0,1,0,0,0,0,0,5,5,5,4,5,5,9,it looks like  all the others to me nothing stands out,its michelob then its not only light but ultra light,1,,,,,1163,0
1633,21-10-2024 13:55,21-10-2024 14:11,54,2,5,11,1,1,0,0,1,0,0,0,0,0,0,1,0,0,0,5,5,5,4,5,5,9,I dont really like it so much,I just like Budweiser,1,,,,,1163,0
1650,12-10-2024 12:39,12-10-2024 12:47,38,1,5,11,1,1,0,1,0,0,1,1,0,1,0,1,1,0,0,5,5,5,4,5,5,9,I don't like nothing about this $1 beer,Everything about it,1,,,,,1163,0
1652,22-10-2024 04:11,22-10-2024 04:30,44,2,5,11,1,0,0,0,0,1,0,0,0,1,0,0,0,0,0,5,5,5,4,5,5,9,I really only like Michelob,Don't know,1,,,,,1163,1
1653,17-10-2024 16:22,17-10-2024 16:32,38,2,5,11,1,0,1,0,0,0,0,1,1,0,1,1,1,0,1,5,5,5,4,5,5,9,the calroies,"not a fan of the packaging, too much gold it feels weird",2,Michelob Ultra,Bud Light,Montuckey,,1163,0
1655,17-10-2024 15:38,17-10-2024 15:54,32,1,5,11,1,0,0,0,0,0,0,1,0,1,0,0,1,0,0,5,5,5,4,5,5,9,That it's light and not to hard when u drink I like a smooth tastw,I can't say I dislike anything about it,3,Corona light,Coors light,Dos xx,,1163,0
1667,22-10-2024 19:08,22-10-2024 19:30,60,2,5,11,1,0,0,0,0,0,0,1,0,1,0,0,0,0,0,5,5,5,4,5,5,9,,,1,,,,,1163,0
1670,17-10-2024 20:04,17-10-2024 20:11,48,2,5,11,1,0,0,0,0,1,1,1,1,1,1,0,1,0,0,5,5,5,4,5,5,9,The color and packaging is nice also.low calories,Nothing,2,Modelo Oro,Dos equis,Seagrams,,1163,1
1671,13-10-2024 17:50,13-10-2024 18:21,64,1,5,11,1,0,0,0,0,1,0,0,1,0,0,0,0,0,0,5,5,5,4,5,5,9,"Organic Light Beer is something new, and different.",Nothing! I would give this product a try.,1,,,,,1163,0
1673,23-10-2024 04:24,23-10-2024 04:36,63,2,5,11,1,0,0,0,0,1,1,0,0,0,0,1,0,0,0,5,5,5,4,5,5,9,No artificial flavors or colors,Light beers usually do not have a true beer taste,1,,,,,1163,0
1675,18-10-2024 00:20,18-10-2024 00:50,48,1,5,11,1,0,0,0,0,0,0,1,0,1,0,0,0,1,0,5,5,5,4,5,5,9,The taste is the most important thing,nothing,2,Heinikein,busch,coors,,1163,1
1677,13-10-2024 14:10,13-10-2024 14:29,61,1,5,11,1,0,0,0,0,0,0,1,0,1,0,0,0,0,0,5,5,5,4,5,5,9,Nothing,Everything,1,,,,,1163,0
1683,11-10-2024 19:32,11-10-2024 19:43,35,1,5,11,1,1,0,0,0,1,1,1,1,1,1,1,1,0,1,5,5,5,4,5,5,9,"One thing I really LIKE about Michelob ULTRA Pure Gold is its commitment to using high-quality, organic ingredients. This sets it apart from many other light lagers on the market and makes me feel better about the ingredients I'm consuming. The fact that it's made with organic grains and without any artificial colors or flavors is really appealing. It's a refreshing option for those who want to enjoy a light beer without compromising on taste or ingredient quality. Additionally, the brand's focus on sustainability and their partnership with farmers to source organic grains is a positive aspect that aligns with my values and makes me more likely to choose this beer over others.","While there are many things to LIKE about Michelob ULTRA Pure Gold, one thing I DISLIKE is that it can be a bit more expensive than other light lagers on the market. The premium ingredients and organic certification are definitely factors in the higher price point, but it can still be challenging to justify the added cost, especially when there are more affordable options available. Additionally, although the taste is generally good for a light beer, some people might find that it lacks the depth and complexity of other craft beers. While this might not be a concern for those seeking a refreshing, easy-drinking lager, it's something to consider for those who prefer more robust flavor profiles.",3,Bud Light,Coors Light,regular Michelob ULTRA,,1163,0
1686,22-10-2024 19:46,22-10-2024 20:09,63,2,5,11,1,0,0,0,0,0,1,0,0,1,0,0,0,0,0,5,5,5,4,5,5,9,It looks like it might be good but I stick to beer that I have drank and I don't drink light beer,Nothing really,2,Budweiser,Bud ice,Old English,,1163,0
1689,22-10-2024 21:14,22-10-2024 21:24,23,2,5,11,1,0,0,0,0,0,0,1,0,1,0,0,0,0,0,5,5,5,4,5,5,9,"The packing and color is beautiful, however I have never tried this alcohol. I would like to one day.",No opinion,1,,,,,1163,0
1698,22-10-2024 00:23,22-10-2024 00:37,53,2,5,11,1,0,0,0,0,0,0,1,0,0,0,1,0,0,0,5,5,5,4,5,5,9,Taste,Nothing,1,,,,,1163,0
1705,22-10-2024 11:44,22-10-2024 11:57,50,2,5,11,1,0,0,0,0,1,0,1,0,1,0,1,1,0,0,5,5,5,4,5,5,9,Keep organic light lager and make it bigger. I like the word pure,That organic isn't in a larger font so you can really see it,1,,,,,1163,1
1714,18-10-2024 06:22,18-10-2024 06:48,44,1,5,11,1,0,0,0,0,0,1,1,0,1,0,0,0,0,0,5,5,5,4,5,5,9,Smooth taste,Nothing,1,,,,,1163,1
1737,21-10-2024 21:53,21-10-2024 22:32,54,2,5,11,1,0,0,0,0,0,1,1,0,1,0,1,1,0,0,5,5,5,4,5,5,9,I'm not really interested in trying Michelob ultra pure gold at all,Michelob is not a brand that I care for I don't really like it,1,,,,,1163,0
1744,12-10-2024 20:09,12-10-2024 20:29,56,1,5,11,1,1,0,0,0,0,0,1,0,1,0,0,0,0,0,5,5,5,4,5,5,9,Light beer with full flavor.,The price.,1,,,,,1163,0
1745,18-10-2024 06:04,18-10-2024 06:26,47,1,5,11,1,0,0,0,0,1,0,1,1,1,0,0,1,0,0,5,5,5,4,5,5,9,Is made with natural and organic ingredients and it only has 85% calories,There's nothing I dislike,2,Bud light,Corona extra,Modelo,,1163,1
1746,21-10-2024 19:36,21-10-2024 20:05,51,2,5,11,1,0,0,0,0,1,0,1,1,1,0,1,1,0,0,5,5,5,4,5,5,9,I liked that it is light on alcohol content and yet still refreshing,I don’t dislike anything,2,Rolling rock,Millet light,Spycam,,1163,1
1751,22-10-2024 20:22,22-10-2024 20:42,55,2,5,11,1,0,0,0,0,1,1,1,0,1,0,1,1,0,0,5,5,5,4,5,5,9,85 Calories,Price,2,IPA,New Belgium,Hornitos tequila,,1163,0
1756,22-10-2024 04:09,22-10-2024 04:22,25,1,5,11,1,1,0,0,0,1,1,1,1,1,0,0,1,0,1,5,5,5,4,5,5,9,I believe I would like the flavor ultra light has as a beef compared to other beers I had in the past,I don’t have any dislikes about ultra light maybe the design,1,,,,,1163,0
1770,21-10-2024 19:28,21-10-2024 19:49,61,1,5,11,1,0,0,0,0,0,0,1,1,0,0,0,0,0,0,5,5,5,4,5,5,9,It looks like it would be a pilsner tap beer and that's not my favorite type of beer.,I just don't believe that I would like it,2,Bud light,Budweiser,Michelob dark,,1163,0
1775,22-10-2024 16:47,22-10-2024 16:54,36,1,5,11,1,1,1,1,0,1,1,1,1,1,0,1,1,1,1,5,5,5,4,5,5,9,Everything about it,Nothing exactly,3,Leo,Kiki,Nike,,1163,0
1784,14-10-2024 21:02,14-10-2024 21:12,38,2,5,11,1,1,1,0,0,1,1,1,1,0,0,1,1,0,1,5,5,5,4,5,5,9,alcohol content,nothing,1,,,,,1163,0
1809,22-10-2024 16:00,22-10-2024 16:15,40,1,5,11,1,0,0,0,0,0,0,1,0,1,0,1,0,0,0,5,5,5,4,5,5,9,It low on alcohol level,Could have more alcohol in it or lower the price,1,,,,,1163,0
1815,17-10-2024 19:50,17-10-2024 19:56,30,1,5,11,1,0,0,1,0,1,1,1,1,1,0,1,0,0,0,5,5,5,4,5,5,9,One thing I like about Michelob uktra lite is the calorie intake being so low.,There’s nothing I dislike,3,Bud lite,Miller lire,Natural ice,,1163,0
1844,21-10-2024 23:07,21-10-2024 23:27,40,1,5,11,1,1,1,1,1,1,1,1,1,1,1,1,1,1,1,5,5,5,4,5,5,9,I like the brand that makes it and I like the amount of alcohol by volume in it,I don't dislike anything about it,3,Budweiser,Carona,Heineken,,1163,0
1846,13-10-2024 08:16,13-10-2024 08:22,61,2,5,11,1,1,1,1,0,1,1,1,1,1,1,0,1,0,0,5,5,5,4,5,5,9,taste great,nothing to dislike,2,bush,miller,stella ataria,,1163,0
1848,19-10-2024 02:43,19-10-2024 02:54,35,2,5,11,1,1,1,1,1,1,1,1,1,1,0,1,1,0,1,5,5,5,4,5,5,9,The branding is cool,nothing to dislike,1,,,,,1163,0
1856,22-10-2024 11:22,22-10-2024 12:05,49,2,5,11,1,1,1,0,0,1,1,1,1,1,1,1,1,1,1,5,5,5,4,5,5,9,"I appreciate that Michelob ULTRA pure Gold is USDA certified organic, offering a refreshing taste while prioritizing natural ingredients.",I dislike that Michelob ULTRA Pure Gold has a relatively low flavor profile compared to more robust craft beers.,1,,,,,1163,0
1871,22-10-2024 02:20,22-10-2024 02:33,58,2,5,11,1,0,0,0,0,1,1,1,0,1,0,1,1,0,0,5,5,5,4,5,5,9,I am not a fan of light beers but I do like the Michelob brand so I may try it one time.,That it's an ultra light beer. I think they're Way Too Thin.,1,,,,,1163,0
1878,23-10-2024 04:51,23-10-2024 05:24,63,2,5,11,1,0,0,0,0,0,1,1,0,1,0,1,0,1,0,5,5,5,4,5,5,9,I don't care for light beers,I don't care for light beers,1,,,,,1163,0
1880,21-10-2024 21:44,21-10-2024 22:07,59,1,5,11,1,0,0,0,0,0,1,1,1,0,0,0,0,0,0,5,5,5,4,5,5,9,That it is made by Michelob,nothing,2,Coors Light,Michelob Ultra,Busch Light,,1163,0
1887,21-10-2024 20:33,21-10-2024 20:44,41,1,5,11,1,1,1,1,1,1,1,1,1,1,1,1,1,1,1,5,5,5,4,5,5,9,The best thing about,Good to know,3,Nik4,Nil,Bat,,1163,0
1900,13-10-2024 05:30,13-10-2024 05:36,29,2,5,11,1,1,0,1,0,1,1,0,1,0,0,0,0,0,0,5,5,5,4,5,5,9,I like the flavor,Nothing,1,,,,,1163,0
1906,21-10-2024 16:43,21-10-2024 16:53,53,2,5,11,1,0,0,0,0,0,0,0,0,1,0,0,0,0,0,5,5,5,4,5,5,9,The taste,Nothing,2,Michelob,,,,1163,0
1949,17-10-2024 19:36,17-10-2024 19:46,35,2,5,11,1,1,1,1,0,1,1,1,1,1,1,1,1,0,1,5,5,5,4,5,5,9,"I love Michelob Ultra Pure Gold for its refreshing, smooth taste and impressive health-conscious features, including low calories, carbs, and gluten-free ingredients. Its eco-friendly brewing process and commitment to sustainability also align with my values, making it my top choice for a premium light lager. It is the best I have seen","Yeah 
Michelob Ultra Pure Gold doesn't quite meet my expectations in terms of flavor.",3,Sprite,Bud,Baron,,1163,0
1954,17-10-2024 06:15,17-10-2024 07:02,35,2,5,11,1,1,1,1,1,1,1,1,1,1,0,1,1,1,1,5,5,5,4,5,5,9,I like taste and design quality of the products and flavors,model and design  of the color of the drink.,1,,,,,1163,0
1979,17-10-2024 20:02,17-10-2024 20:23,46,2,5,11,1,0,0,0,0,1,0,1,0,1,0,1,1,1,0,5,5,5,4,5,5,9,The fact that it's completely organic,That it's a light beer,1,,,,,1163,1
1981,21-10-2024 20:22,21-10-2024 20:41,56,2,5,11,1,0,0,0,0,1,0,1,0,1,0,1,1,0,0,5,5,5,4,5,5,9,The ingredients and the description of the beer’s quality,Michelob Ultra was okay but not great; how will this new version improve on that?,1,,,,,1163,0
1983,23-10-2024 05:33,23-10-2024 05:46,61,1,5,11,1,0,0,0,0,1,0,0,0,0,0,1,0,0,0,5,5,5,4,5,5,9,Use of organic materials,I typically don't enjoy light lagers or bs about gold,1,,,,,1163,0
1984,17-10-2024 23:40,17-10-2024 23:52,55,1,5,11,1,0,0,0,0,0,0,1,0,1,0,0,0,0,0,5,5,5,4,5,5,9,I like the fact that it has alcohol,Nothing,1,,,,,1163,0
1986,22-10-2024 19:37,22-10-2024 19:58,63,2,5,11,1,0,0,0,0,0,0,1,0,1,0,0,0,0,0,5,5,5,4,5,5,9,It’s organic and 85 calories,It’s fine the way it is,2,Corona,Budweiser,Coors,,1163,0
