2009,22-10-2024 05:40,22-10-2024 06:05,37,2,5,11,1,1,0,1,1,0,1,1,1,0,0,1,1,1,0,5,5,5,4,5,5,9,I love the amazing taste I love the product I love the design the style the price,I don't have any dislikes,3,Budweiser,Stella Artois,Corona Extra,,1163,0
2018,21-10-2024 19:57,21-10-2024 20:57,40,1,5,11,1,0,0,0,0,1,1,0,1,1,0,0,0,1,0,5,5,5,4,5,5,9,It is light beer and i like light beers,There is nothing specific that i dislike,2,budweiser,heineken,corona,,1163,0
2026,17-10-2024 15:43,17-10-2024 15:50,38,2,5,11,1,1,1,1,1,1,1,1,1,1,1,1,1,0,1,5,5,5,4,5,5,9,High quality,Nothing,3,Corona,Heinken,Almaza,,1163,0
2037,23-10-2024 04:47,23-10-2024 05:02,59,2,5,11,1,0,0,0,0,0,0,0,0,1,0,0,0,0,0,5,5,5,4,5,5,9,It's a pretty bottle,I don't drink it,1,,,,,1163,0
2052,21-10-2024 21:49,21-10-2024 21:57,27,1,5,11,1,0,0,0,0,0,0,1,0,1,0,1,0,1,0,5,5,5,4,5,5,9,The price,It's light,1,,,,,1163,0
2066,13-10-2024 01:53,13-10-2024 02:07,26,1,5,11,1,0,0,0,0,1,0,1,1,1,0,1,0,0,0,5,5,5,4,5,5,9,The taste,Nothing,3,Budweiser,Lager beer,Heineken,,1163,0
2072,22-10-2024 07:45,22-10-2024 08:16,63,2,5,11,1,0,0,0,0,0,1,1,0,1,0,0,1,0,0,5,5,5,4,5,5,9,The Michelob brand,The price,1,,,,,1163,0
2076,16-10-2024 07:09,16-10-2024 07:16,34,1,5,11,1,1,0,1,0,1,1,1,0,1,1,1,0,1,0,5,5,5,4,5,5,9,I like another light beer option,A little pricey,2,bud light,miller light,corona light,,1163,0
2085,18-10-2024 09:40,18-10-2024 10:16,39,1,5,11,1,0,0,0,0,1,0,0,1,0,0,0,0,0,0,5,5,5,4,5,5,9,The taste because taste is everything,Nothing,2,Miller Light,Bud light,Corona,,1163,0
2093,16-10-2024 16:13,16-10-2024 16:27,45,1,5,11,1,0,0,0,0,0,0,0,1,0,0,0,1,0,0,5,5,5,4,5,5,9,It being a little better for me,The color with the label makes it kind of look like a bottle of pee,1,,,,,1163,1
2094,22-10-2024 16:22,22-10-2024 16:29,43,1,5,11,1,0,0,1,0,1,0,0,0,1,0,0,1,0,0,5,5,5,4,5,5,9,the whole thing is damn good,none of it,2,good taste,smooth,easy to eat,,1163,1
2098,11-10-2024 11:05,11-10-2024 12:00,30,1,5,11,1,1,0,0,0,1,1,1,1,1,1,1,0,1,1,5,5,5,4,5,5,9,"The taste is top notch,the packaging is epic, I love the branding","Nothing much, just there availability",2,Heineken,budweizer,Miller lite,,1163,0
2099,17-10-2024 15:30,17-10-2024 15:36,39,1,5,11,1,1,1,1,1,1,1,1,1,1,1,1,0,0,0,5,5,5,4,5,5,9,Has the best ingredients and flavors,Has the best ingredients and flavors,2,modern,best,better,,1163,0
2113,14-10-2024 00:39,14-10-2024 00:46,53,1,5,11,1,1,0,0,0,1,1,1,1,1,1,0,0,1,0,5,5,5,4,5,5,9,That’s it’s from michelob,Nothing to dislike,2,Budweiser,Miller,Bud light,,1163,0
2125,16-10-2024 18:35,16-10-2024 18:53,37,2,5,11,1,1,0,1,0,1,1,1,1,1,0,1,1,0,0,5,5,5,4,5,5,9,I liked the price it's great,Nothing I disliked,1,,,,,1163,0
2130,12-10-2024 16:14,12-10-2024 16:29,23,2,5,11,1,1,0,0,0,0,0,0,0,0,1,0,1,0,0,5,5,5,4,5,5,9,organic,nothing,2,modelo,corona,ultra,,1163,0
2136,21-10-2024 17:44,21-10-2024 17:55,60,2,5,11,1,0,0,1,0,1,0,1,1,0,0,0,0,0,0,5,5,5,4,5,5,9,I'm not a fan of Ultra,Tastes watered down,1,,,,,1163,0
2145,22-10-2024 20:46,22-10-2024 21:29,65,2,5,11,1,1,1,0,0,1,0,1,0,1,0,1,0,1,0,5,5,5,4,5,5,9,Low in calories and brewed with fine ingredients,Not a fan of the label,1,,,,,1163,0
2158,18-10-2024 07:34,18-10-2024 07:45,58,1,5,11,1,0,0,0,0,1,0,1,0,1,0,1,0,0,0,5,5,5,4,5,5,9,American,Cost,1,,,,,1163,0
2170,23-10-2024 00:38,23-10-2024 00:47,40,1,5,11,1,1,1,1,1,1,1,1,1,1,1,1,1,0,1,5,5,5,4,5,5,9,Thank you for the opportunity to interview with you and I look forward to your interview with you and I,Thank you for the opportunity to interview with you and I look forward to,3,Sadimaa,Aiakana,Aiajanjaai,,1163,0
2172,22-10-2024 14:15,22-10-2024 14:27,36,1,5,11,1,1,0,0,0,0,0,1,0,1,0,1,0,0,0,5,5,5,4,5,5,9,I don't like anything about this beverage,I don't like the amount of alcohol it contains,1,,,,,1163,0
2176,22-10-2024 05:34,22-10-2024 05:44,39,1,5,11,1,0,0,1,0,1,1,0,0,1,0,0,1,0,0,5,5,5,4,5,5,9,Smooth taste,Nothing,2,Corona,Heineken,Budweiser,,1163,0
2177,22-10-2024 03:07,22-10-2024 04:03,41,2,5,11,1,1,1,1,1,1,1,1,1,1,1,1,1,1,1,5,5,5,4,5,5,9,I like that it does not have any artificial ingredients,I do not dislike anything about it,2,Corona Extra,Budweiser,Heineken,,1163,0
2184,17-10-2024 19:31,17-10-2024 19:47,53,2,5,11,1,0,0,0,0,0,0,0,0,0,0,1,0,0,0,5,5,5,4,5,5,9,The taste,Nothing,2,Bud light,Bush,Budweiser,,1163,0
2185,18-10-2024 00:24,18-10-2024 00:34,39,1,5,11,1,1,0,1,0,1,1,1,1,1,0,1,0,1,0,5,5,5,4,5,5,9,That it's organic,The design,2,Milwaukee best,Icehouse,Modelo,,1163,0
2193,13-10-2024 15:28,13-10-2024 15:31,28,2,5,11,1,1,1,1,0,1,1,1,1,1,0,1,0,0,0,5,5,5,4,5,5,9,Everything is great,Nothing at all,2,Love it,Bud light,Corona,,1163,0
2196,15-10-2024 01:05,15-10-2024 01:15,62,2,5,11,1,0,0,0,0,0,0,1,0,1,0,0,0,0,0,5,5,5,4,5,5,9,Everything,Nothing,1,,,,,1163,0
2205,11-10-2024 10:00,11-10-2024 10:12,28,1,5,11,1,1,0,0,0,1,1,0,1,0,0,0,0,0,0,5,5,5,4,5,5,9,I like the color,I don't think will taste good,1,,,,,1163,0
2207,22-10-2024 06:56,22-10-2024 07:26,54,2,5,11,1,0,0,0,0,0,0,0,1,1,0,0,0,0,0,5,5,5,4,5,5,9,The color gold,I haven't  tried it so nothing .,1,,,,,1163,0
2209,18-10-2024 05:34,18-10-2024 05:54,48,2,5,11,1,0,0,0,0,0,0,0,0,1,0,0,0,0,0,5,5,5,4,5,5,9,There's nothing I like about the product,I don't like this brand of beer,1,,,,,1163,1
2223,14-10-2024 21:20,14-10-2024 21:33,33,2,5,11,1,0,0,0,0,1,0,0,0,0,0,0,1,0,0,5,5,5,4,5,5,9,I’ve never tasted it,I’ve never tried it,1,,,,,1163,0
2234,23-10-2024 04:33,23-10-2024 05:09,63,1,5,11,1,0,0,1,0,0,0,0,0,1,0,0,1,0,0,5,5,5,4,5,5,9,Don’t feel that the USDA organic will sell the beer,I wouldn’t try it because of the brand of the Michelob beer,1,,,,,1163,0
2278,12-10-2024 20:54,12-10-2024 21:12,35,1,5,11,1,0,0,0,0,1,0,1,1,0,0,0,1,1,0,5,5,5,4,5,5,9,has got no Hungover,nothing,3,Bud lights,natural lite,modelo,,1163,0
2285,12-10-2024 17:36,12-10-2024 17:45,30,2,5,11,1,1,0,0,0,1,1,1,0,1,0,1,1,0,0,5,5,5,4,5,5,9,It’s beer for everyone no matter your race.,There is nothing I dislike about the product,1,,,,,1163,0
2287,17-10-2024 06:12,17-10-2024 06:23,39,1,5,11,1,1,1,1,1,1,1,1,1,1,1,1,1,1,1,5,5,5,4,5,5,9,I like the color of the product.,I don't dislike anything about it.,3,Heineken,Budweiser,Guinness,,1163,0
2295,13-10-2024 13:25,13-10-2024 13:41,46,1,5,11,1,1,0,1,0,0,1,1,0,1,0,1,1,0,0,5,5,5,4,5,5,9,I like the fact that it's a extra logger that means a little stronger than the other of Michelob ultra.,I do not know too much about the brand of Michelob Argo I would like to learn more.,1,,,,,1163,0
2300,13-10-2024 17:52,13-10-2024 18:03,45,2,5,11,1,0,0,1,0,0,0,1,0,1,0,0,1,0,0,5,5,5,4,5,5,9,The labeling is good could be better,Too much like Corona,1,,,,,1163,1
2315,13-10-2024 20:44,13-10-2024 20:55,30,1,5,11,1,1,1,0,0,1,1,1,1,1,0,1,0,1,1,5,5,5,4,5,5,9,the ingredient and taste,nothing to dislike,2,corana,dos eqstos,budlight,,1163,0
2328,17-10-2024 01:02,17-10-2024 01:11,26,2,5,11,1,0,0,1,1,0,1,1,1,1,1,1,0,0,0,5,5,5,4,5,5,9,"It is unique, high quality and innovative",No comment,2,Bud light,Budweiser,Vodka,,1163,0
2332,17-10-2024 01:59,17-10-2024 02:16,38,2,5,11,1,1,1,1,1,1,1,1,1,1,1,1,1,0,1,5,5,5,4,5,5,9,I like how appealing the pacakaging looks and the ingredients used in the making,I do not dislike anything at all,1,,,,,1163,0
2359,16-10-2024 21:51,16-10-2024 22:34,50,2,5,11,1,1,0,0,0,0,0,1,0,1,0,0,1,1,0,5,5,5,4,5,5,9,Organic and no artificial colors,N/a,1,,,,,1163,0
2388,21-10-2024 12:29,21-10-2024 13:06,36,1,5,11,1,1,0,1,0,0,0,1,0,1,0,0,0,0,0,5,5,5,4,5,5,9,it looks like it tastes good,nothing,1,,,,,1163,0
2390,21-10-2024 09:07,21-10-2024 09:15,43,1,5,11,1,0,0,1,0,0,0,0,0,1,0,0,0,1,0,5,5,5,4,5,5,9,its organic,nothing,2,budweiser,miller,corona,,1163,1
2391,16-10-2024 18:48,16-10-2024 19:16,41,1,5,11,1,1,1,1,1,1,1,1,1,1,1,1,1,0,1,5,5,5,4,5,5,9,the flavors,,3,Bud,bosch,corona,,1163,0
2392,21-10-2024 14:11,21-10-2024 14:20,41,2,5,11,1,1,1,1,1,1,1,1,1,1,1,1,1,1,1,5,5,5,4,5,5,9,It is so tasty,I don't dislike any thing,3,Corona,Millers,Chivas,,1163,0
2396,16-10-2024 20:17,16-10-2024 20:22,32,1,5,11,1,1,0,1,1,1,1,1,0,1,1,1,0,1,0,5,5,5,4,5,5,9,Like,Dislike,2,,No,N9,,1163,0
2401,21-10-2024 20:37,21-10-2024 20:51,41,1,5,11,1,0,0,0,0,0,0,0,0,0,0,1,0,0,0,5,5,5,4,5,5,9,I don't like anything really about jt,It's not my kind of beer.,1,,,,,1163,0
2408,22-10-2024 10:53,22-10-2024 10:59,39,2,5,11,1,1,0,1,0,1,1,1,1,0,1,1,0,0,0,5,5,5,4,5,5,9,the low calories and the look of it,nothing,2,bud light,corona,heiniken,,1163,0
2410,21-10-2024 20:57,21-10-2024 21:11,62,2,5,11,1,0,0,1,0,1,1,0,0,0,0,1,0,0,0,5,5,5,4,5,5,9,Nothing. I only drink Craft beer,Everything,2,,,,,1163,0
2418,17-10-2024 07:49,17-10-2024 07:59,23,1,5,11,1,1,0,1,0,1,0,1,0,1,0,1,0,0,0,5,5,5,4,5,5,9,it'll get me drunk,expensive,2,corona,heineken,mike's,,1163,0
2422,21-10-2024 14:36,21-10-2024 14:47,50,2,5,11,1,0,0,1,0,0,0,0,0,1,0,0,0,0,0,5,5,5,4,5,5,9,it looks good,nothing,2,i'm not sure,don't,know,,1163,1
2452,17-10-2024 06:15,17-10-2024 06:23,51,2,5,11,1,0,0,1,0,0,1,1,1,1,0,1,0,1,0,5,5,5,4,5,5,9,The ingredients and the taste,nothing at all,2,Corona,Corona light,Corona gold,,1163,1
2454,16-10-2024 02:17,16-10-2024 02:59,59,2,5,11,1,0,0,0,0,0,0,1,0,1,0,0,0,0,0,5,5,5,4,5,5,9,I like the taste of Michellob Ultra very much.,I dislike the price of Michelob Ultra Pure Gold.,1,,,,,1163,0
2470,19-10-2024 07:28,19-10-2024 07:36,61,1,5,11,1,1,0,1,0,0,1,1,1,1,0,0,1,0,0,5,5,5,4,5,5,9,Brand and taste,Nothing,1,,,,,1163,0
2490,21-10-2024 14:22,21-10-2024 15:19,28,2,5,11,1,1,1,1,1,1,1,1,1,1,1,1,1,1,1,5,5,5,4,5,5,9,It’s lighter,Nothing,3,Bud,Mikes hard,Wine,,1163,0
2493,23-10-2024 12:15,23-10-2024 12:22,60,1,5,11,1,0,0,0,0,0,0,1,0,1,0,0,0,1,0,5,5,5,4,5,5,9,nothing,it is super light,1,,,,,1163,0
2501,23-10-2024 12:39,23-10-2024 12:47,53,1,5,11,1,0,0,0,0,0,1,1,0,1,0,0,1,0,0,5,5,5,4,5,5,9,That is has less calories than a regular beer,The flavor profile,1,,,,,1163,0
2518,23-10-2024 13:10,23-10-2024 13:28,60,2,5,11,1,0,0,0,0,1,0,0,0,1,0,0,0,0,0,5,5,5,4,5,5,9,The design of the bottle,It has a low alcohol content,2,Bud ice,Budwiser,Bud light,1,1163,0
2532,23-10-2024 13:47,23-10-2024 13:54,64,1,5,11,1,0,0,0,0,0,0,0,1,1,0,1,0,1,0,5,5,5,4,5,5,9,nothing,too expensive,2,none,none,none,,1163,0
2539,23-10-2024 13:55,23-10-2024 14:12,61,2,5,11,1,1,0,0,0,1,1,1,1,1,1,1,1,0,0,5,5,5,4,5,5,9,Low calories,Less taste,2,Miller Lite,Michelob Ultra,Corona Light,,1163,0
2544,23-10-2024 14:09,23-10-2024 14:21,57,1,5,11,1,0,0,0,0,0,1,1,0,1,0,0,1,0,0,5,5,5,4,5,5,9,I would never buy it,Everything,1,,,,,1163,0
2548,23-10-2024 14:23,23-10-2024 14:27,31,1,5,11,1,1,0,0,1,1,1,1,1,1,1,0,0,1,1,5,5,5,4,5,5,9,It looks greaT,Nothing it’s perfect,3,Heineken,Miller lite,Bud light,,1163,0
2552,23-10-2024 14:22,23-10-2024 14:33,52,1,5,11,1,0,0,0,0,0,0,1,0,1,0,0,0,0,0,5,5,5,4,5,5,9,This beer is very smooth and light and good tasting,There is nothing I dislike about it,1,,,,,1163,0
2553,23-10-2024 14:06,23-10-2024 14:35,35,1,5,11,1,1,0,0,0,1,1,1,0,1,0,1,1,0,0,5,5,5,4,5,5,9,The taste,Nothing,1,,,,,1163,0
2568,23-10-2024 14:29,23-10-2024 14:42,59,1,5,11,1,1,0,1,0,1,0,1,1,1,0,1,0,1,1,5,5,5,4,5,5,9,smooth taste and good with food,not enough ad amoung the top beers,2,budwiser,hinekin,miler,,1163,0
2575,23-10-2024 14:42,23-10-2024 14:47,38,1,5,11,1,0,0,0,0,0,1,1,1,0,0,0,1,0,0,5,5,5,4,5,5,9,Great taste,Price probably,1,,,,,1163,0
2585,23-10-2024 14:44,23-10-2024 14:53,59,2,5,11,1,0,0,1,0,0,0,1,0,1,0,0,0,0,0,5,5,5,4,5,5,9,Darker beer,,2,Michelob ultra,,,,1163,0
2586,23-10-2024 14:46,23-10-2024 14:53,36,1,5,11,1,1,0,0,0,0,1,0,1,1,1,0,0,1,0,5,5,5,4,5,5,9,it has a third less alcohol,the calories that it has,1,,,,,1163,0
2588,23-10-2024 14:47,23-10-2024 14:55,24,2,5,11,1,1,0,1,0,1,1,0,1,0,0,1,1,1,0,5,5,5,4,5,5,9,The first time,The only first,3,Bubt,Hehb,Hub,,1163,0
2589,23-10-2024 14:39,23-10-2024 14:55,58,1,5,11,1,0,0,0,0,0,1,1,1,0,0,0,1,0,0,5,5,5,4,5,5,9,Brewed with homegrown ingredients and low carbs,Low alcohol content. Don’t have time or belly to drink enough to feel good,1,,,,,1163,0
2592,23-10-2024 14:44,23-10-2024 14:59,27,1,5,11,1,1,0,0,0,0,1,1,1,0,0,1,1,1,0,5,5,5,4,5,5,9,,Everything,1,,,,,1163,0
2595,23-10-2024 14:38,23-10-2024 15:00,64,1,5,11,1,0,0,0,0,0,0,0,1,1,0,0,1,1,0,5,5,5,4,5,5,9,"The description is perfectly clear, it's crisp and balanced beer, only 70 calories, golden, less alcohol, superior, and good as gold!  Yummy!!!","none really, but I enjoy can beer not glass.",1,,,,,1163,0
2603,23-10-2024 14:48,23-10-2024 15:09,62,2,5,11,1,0,0,1,0,1,0,1,1,0,0,0,1,1,0,5,5,5,4,5,5,9,"Organic beer? Yes, please! I have not seen this product before, but live to try it.",Our local recycler does not recycle glass. Aluminum is a better choice.,2,Corona,Coors,Guinness,,1163,0
2605,23-10-2024 14:56,23-10-2024 15:11,35,1,5,11,1,1,0,1,0,0,1,1,1,1,0,1,1,0,0,5,5,5,4,5,5,9,I like the flavor and taste,Nothing,1,,,,,1163,0
2617,23-10-2024 15:14,23-10-2024 15:29,35,2,5,11,1,1,0,1,0,1,1,1,1,1,0,1,1,0,0,5,5,5,4,5,5,9,I like that it has a third less alcohol content to it,"The price. It's too expensive for the alcohol content it has. Around my house, I could get a 4pk of 16 oz cans of regular Heineken for $1 less, and the alcohol content is 5%.",2,Coors Light,Heineken,Budlight,,1163,0
2618,23-10-2024 15:24,23-10-2024 15:30,33,1,5,11,1,1,0,1,1,0,1,1,0,0,1,1,0,1,1,5,5,5,4,5,5,9,It’s a very cool design which I like,It’s too bright,2,It’s fun,Cool,Hreat,,1163,0
2628,23-10-2024 15:29,23-10-2024 15:39,61,1,5,11,1,1,0,0,0,1,1,1,0,1,0,1,1,0,0,5,5,5,4,5,5,9,That its Organic,"Nothing ,I liked the taste",2,Coors Lite,Modell,Budweiser,,1163,0
2632,23-10-2024 15:12,23-10-2024 15:47,64,2,5,11,1,1,0,0,0,1,1,0,0,1,0,0,0,0,0,5,5,5,4,5,5,9,No comment,No comment,1,,,,,1163,0
2633,23-10-2024 15:40,23-10-2024 15:47,28,2,5,11,1,0,0,0,0,0,1,1,0,1,0,1,1,0,0,5,5,5,4,5,5,9,Its pure.,Nothing,1,,,,,1163,0
2638,23-10-2024 15:45,23-10-2024 15:55,58,1,5,11,1,0,0,0,0,0,0,0,0,1,0,0,0,0,0,5,5,5,4,5,5,9,There's nothing I like about it,Everything it's not my brand or taste,1,,,,,1163,0
2640,23-10-2024 15:45,23-10-2024 15:57,55,2,5,11,1,0,0,0,0,0,1,0,1,0,0,0,0,0,0,5,5,5,4,5,5,9,Low carbs,,1,,,,,1163,0
2656,23-10-2024 16:25,23-10-2024 16:41,25,1,5,11,1,1,1,1,1,1,1,1,1,0,1,1,1,1,1,5,5,5,4,5,5,9,i liked everything about it,there wasnt anything i didnt like,2,budlight,coors light,michelob pure gold,,1163,0
2659,23-10-2024 17:02,23-10-2024 17:08,26,1,5,11,1,1,0,1,0,1,0,1,1,0,1,1,1,0,0,5,5,5,4,5,5,9,I love the color and the appeal. It is very refreshing and eye catching,It is a bit pricey,2,Coors Lite,Heineken,Modelo,,1163,0
2663,23-10-2024 17:50,23-10-2024 18:05,32,2,5,11,1,1,1,1,1,1,1,1,1,1,1,1,1,1,1,5,5,5,4,5,5,9,"It's low on calories, and the price is very reasonable",There isn't anything that I dislike about this,3,Bud light,Corona light,Dox,,1163,0
2673,23-10-2024 18:32,23-10-2024 18:51,62,1,5,11,1,0,0,0,0,0,0,0,1,0,0,0,0,0,0,5,5,5,4,5,5,9,there's nothing I like about it,I just don't drink Michelob,2,Budweiser,Bud Light,Bud Light,,1163,0
2679,23-10-2024 18:54,23-10-2024 19:06,37,2,5,11,1,1,0,1,1,1,1,0,1,1,0,1,1,0,0,5,5,5,4,5,5,9,I like the price,Nothing I dislike,2,Miller lite,Budweiser,Heineken,,1163,0
2680,23-10-2024 18:57,23-10-2024 19:07,64,1,5,11,1,0,0,0,0,0,0,0,0,1,0,0,1,0,0,5,5,5,4,5,5,9,Only 85 calories,nothing,1,,,,,1163,0
2682,23-10-2024 18:53,23-10-2024 19:13,36,1,5,11,1,1,1,0,0,0,0,1,1,0,0,1,0,0,0,5,5,5,4,5,5,9,Don't like Michelob,Does not taste good to me,1,,,,,1163,0
2700,23-10-2024 19:48,23-10-2024 20:18,65,1,5,11,1,0,0,0,0,0,0,1,0,0,0,1,0,0,0,5,5,5,4,5,5,9,label,nothing,1,,,,,1163,0
2713,23-10-2024 23:06,23-10-2024 23:35,61,1,5,11,1,1,0,0,0,0,0,1,0,0,0,1,1,1,0,5,5,5,4,5,5,9,I would never drink this beer,Everything,1,,,,,1163,0
2720,24-10-2024 06:57,24-10-2024 07:15,34,1,5,11,1,1,1,1,1,1,1,1,1,1,0,1,0,0,0,5,5,5,4,5,5,9,,,3,,,,,1163,0
2723,24-10-2024 08:12,24-10-2024 08:23,63,2,5,11,1,0,0,0,0,0,0,0,0,1,0,0,0,0,0,5,5,5,4,5,5,9,,,3,One,,Bud light,,1163,0
2729,24-10-2024 11:01,24-10-2024 11:05,29,2,5,11,1,1,0,1,1,1,1,1,0,1,0,1,1,0,0,5,5,5,4,5,5,9,I like the flavor profile and the ingredients and the bottle,I don’t dislike anything,1,,,,,1163,0
2738,24-10-2024 11:20,24-10-2024 11:36,50,2,5,11,1,0,0,0,0,0,1,0,0,1,0,0,0,0,0,5,5,5,4,5,5,9,The calories are great.,Nothing,2,Yuenling,Bud light,Keystone,,1163,1
2739,24-10-2024 11:28,24-10-2024 11:37,54,1,5,11,1,1,0,0,0,0,1,1,0,1,0,1,0,0,0,5,5,5,4,5,5,9,IT looks good,Nothing to dislike,2,Corona,Budweiser,Modelo,,1163,0
2740,24-10-2024 11:28,24-10-2024 11:38,59,2,5,11,1,0,0,0,0,0,0,1,0,0,0,0,0,1,0,5,5,5,4,5,5,9,There is t anything that I like. One of my grown daughters and some friends drink the ultra version but I only drink imported beer. I would buy it for company.,I don’t care for the taste of Michelin in general.,1,,,,,1163,0
2746,24-10-2024 11:40,24-10-2024 11:52,38,2,5,11,1,1,1,1,0,1,1,1,0,0,1,1,1,1,0,5,5,5,4,5,5,9,The light beer.,Nothing I can see.,2,smooth,light,refreshing,,1163,0
2751,24-10-2024 11:54,24-10-2024 12:02,35,1,5,11,1,0,0,0,0,1,0,1,1,1,0,0,0,0,0,5,5,5,4,5,5,9,it is a low calorie but high quality beer,"nothing, i like the brand",1,,,,,1163,0
2762,24-10-2024 12:16,24-10-2024 12:22,49,2,5,11,1,1,0,0,0,0,1,0,0,0,0,0,1,0,0,5,5,5,4,5,5,9,It looks like it would taste good,There's nothing that I dislike about the product,1,,,,,1163,0
2769,24-10-2024 12:23,24-10-2024 12:31,52,2,5,11,1,0,0,0,0,1,0,1,0,1,0,0,1,0,0,5,5,5,4,5,5,9,The ingredients and the presentation,Nothing,3,Corona,Michelob,Heineken,,1163,0
2771,24-10-2024 12:11,24-10-2024 12:33,64,2,5,11,1,0,0,0,0,1,0,1,1,0,0,1,0,0,0,5,5,5,4,5,5,9,The carbs and calories. Already drink Michelob Ultra and this could be good .,I don't see or read anything that I dislike .,2,Michelob Ultra,modelo,Corona extra,,1163,0
2782,24-10-2024 12:27,24-10-2024 12:39,57,2,5,11,1,0,0,0,0,1,0,0,0,0,0,1,0,0,0,5,5,5,4,5,5,9,Organic and light,Prefer craft beer,1,,,,,1163,0
2797,24-10-2024 12:50,24-10-2024 12:54,38,2,5,11,1,0,0,1,0,1,1,1,1,0,0,0,0,0,0,5,5,5,4,5,5,9,I like the way it looks,Nothing,2,Mich ultra,Coors light,Barefoot,,1163,0
2806,24-10-2024 12:53,24-10-2024 12:59,40,1,5,11,1,1,0,1,0,1,1,1,0,1,1,0,1,1,0,5,5,5,4,5,5,9,Was so excited,Low quality product,3,Amazon,Hulu,Walmart,,1163,0
2817,24-10-2024 12:43,24-10-2024 13:04,36,1,5,11,1,1,0,0,0,0,1,1,1,1,0,0,0,0,0,5,5,5,4,5,5,9,It's made with organic American ingredients,It is expensive for my budget.,1,,,,,1163,0
2824,24-10-2024 12:52,24-10-2024 13:07,35,2,5,11,1,1,0,1,0,1,1,1,0,1,0,1,1,1,0,5,5,5,4,5,5,9,Not buy it,It's ultra light,1,,,,,1163,0
2825,24-10-2024 13:00,24-10-2024 13:07,33,1,5,11,1,1,0,0,0,0,1,1,1,1,0,0,0,0,1,5,5,5,4,5,5,9,Nothing,Nothing.,1,,,,,1163,0
2840,24-10-2024 12:56,24-10-2024 13:13,26,2,5,11,1,0,0,0,0,1,0,1,0,0,1,1,1,0,0,5,5,5,4,5,5,9,I like that it’s only 85 calories,I like everything about it,2,Bud light,Coors,Stella,,1163,0
2843,24-10-2024 13:08,24-10-2024 13:14,41,1,5,11,1,0,0,1,1,1,1,0,1,1,0,1,0,1,0,5,5,5,4,5,5,9,i like it,nothing,2,nothing,yes,no,,1163,0
2851,24-10-2024 13:06,24-10-2024 13:16,55,1,5,11,1,1,1,1,0,1,1,1,1,1,0,1,1,0,1,5,5,5,4,5,5,9,Homegrown ingredients and low calories.,Nothing.,1,,,,,1163,0
2858,24-10-2024 12:50,24-10-2024 13:19,56,2,5,11,1,0,0,0,0,0,0,1,1,0,0,0,0,1,0,5,5,5,4,5,5,9,Price is great and 85 calories is exceptional if it tastes good.,The price is likely to go up if it sells well.,2,Michelob ULTRA Light,Stella Artois,Yuengling Lager,,1163,0
2860,24-10-2024 13:02,24-10-2024 13:20,50,1,5,11,1,1,0,0,0,1,0,1,1,1,0,1,1,0,0,5,5,5,4,5,5,9,very good,looks like pee,2,beer,soda,tea,,1163,0
2867,24-10-2024 13:12,24-10-2024 13:22,32,1,5,11,1,0,0,1,0,1,1,1,1,0,1,0,1,1,0,5,5,5,4,5,5,9,It's cool,Nothing,3,,Cool,Cool,,1163,0
2868,24-10-2024 13:11,24-10-2024 13:23,37,2,5,11,1,1,0,1,1,1,1,1,1,1,0,1,1,1,0,5,5,5,4,5,5,9,balanced beer with less alcohol and calories with pure and refreshing taste,"nothing, everything sounds great to me",2,Coors light,corona,bud light,,1163,0
2882,24-10-2024 13:24,24-10-2024 13:29,44,1,5,11,1,1,0,1,0,1,0,1,1,1,0,1,1,0,0,5,5,5,4,5,5,9,ITS GOOD AND BEST,ITS BEST AND GOOD,3,BEST,LUNMO,AMLOP,,1163,0
2892,24-10-2024 13:23,24-10-2024 13:34,33,2,5,11,1,1,0,0,0,0,1,0,0,1,0,1,0,0,0,5,5,5,4,5,5,9,I like that it uses homegrown ingredients for an authentic American taste and that it is only 70 calories.,There's nothing I dislike about the beer.,2,Michelob Ultra,Heineken,,,1163,0
2897,24-10-2024 13:26,24-10-2024 13:35,40,2,5,11,1,1,0,0,0,1,1,1,1,0,0,1,1,0,0,5,5,5,4,5,5,9,the gold color is just unique and awesome,nothing about it is disliked,2,Heineken,Coors Light,Allagash White,,1163,0
2900,24-10-2024 13:24,24-10-2024 13:35,54,2,5,11,1,0,0,0,0,1,1,1,0,1,0,0,0,0,0,5,5,5,4,5,5,9,I would try it just got curiosity. I don't think I have heard of a light lager before,Nothing yet,2,Natty Daddy,Natural Ice,Steel Reserve,,1163,0
2924,24-10-2024 13:22,24-10-2024 13:42,64,2,5,11,1,0,0,0,0,1,0,0,1,0,0,0,0,0,0,5,5,5,4,5,5,9,I like it and will order it when out if offered. I like Michelob as a brand i know.,it is a little pricey.,1,,,,,1163,0
2939,24-10-2024 13:41,24-10-2024 13:47,34,2,5,11,1,1,0,0,0,1,1,1,0,1,1,1,0,0,0,5,5,5,4,5,5,9,I like that it has only 85 calories and very low carbs,"I dislike the name ""pure gold""",2,Bud light,Corona,Miller light,,1163,0
2952,24-10-2024 13:38,24-10-2024 13:49,38,1,5,11,1,1,0,0,0,1,1,1,1,1,0,1,1,0,0,5,5,5,4,5,5,9,this is very satisfied,this very good ULTRA,3,this very good,very nice,very like,,1163,0
2961,24-10-2024 13:40,24-10-2024 13:50,58,1,5,11,1,0,0,0,0,1,0,0,0,0,0,0,1,0,0,5,5,5,4,5,5,9,"I like Michelob by default, so it extends to this variation and would try it..",Nothing generates a dislike of this variation,1,,,,,1163,0
2962,24-10-2024 13:25,24-10-2024 13:50,34,1,5,11,1,1,0,0,0,0,0,0,0,0,0,1,1,1,0,5,5,5,4,5,5,9,I like the modern style,I like the modern style,2,Budweiser,Budweiser,Budweiser,,1163,0
2989,24-10-2024 13:48,24-10-2024 13:57,27,2,5,11,1,0,0,0,0,0,0,1,1,0,0,0,0,0,0,5,5,5,4,5,5,9,,,1,,,,,1163,0
2997,24-10-2024 13:50,24-10-2024 13:58,36,2,5,11,1,0,0,0,0,1,0,1,0,1,0,0,0,1,0,5,5,5,4,5,5,9,I like that it's a light beer,There's nothing I don't like,3,Heineken,Miller lite,Dosequis,,1163,0
3006,24-10-2024 13:47,24-10-2024 14:00,49,1,5,11,1,0,0,0,0,0,0,1,1,0,0,0,0,0,0,5,5,5,4,5,5,9,Nothing about the product appeals to me,Just not my brand,1,,,,,1163,1
3007,24-10-2024 13:49,24-10-2024 14:00,50,1,5,11,1,1,0,1,0,1,1,1,1,0,0,0,1,1,0,5,5,5,4,5,5,9,The design is ok,I can't stand the taste of this beer.  Any of its products have been terrible tasting.  This particular one literally looks like a bottle of urine. I will never drink it.,1,,,,,1163,0
3033,24-10-2024 13:37,24-10-2024 14:04,61,1,5,11,1,0,0,0,0,0,0,0,1,0,0,0,0,0,0,5,5,5,4,5,5,9,American home grown ingredients,The name.  It's too long,2,Bud Light,Bud Select,Busch Light,,1163,0
3036,24-10-2024 13:56,24-10-2024 14:06,31,1,5,11,1,0,0,0,0,1,0,0,1,0,0,1,0,0,0,5,5,5,4,5,5,9,Taste,Darker beer,2,Ultra,Bud lite,Yeuingling,,1163,0
3038,24-10-2024 13:58,24-10-2024 14:07,33,1,5,11,1,0,0,0,0,0,0,1,1,0,0,1,0,0,0,5,5,5,4,5,5,9,It looks like a good tasting light beer I wouldn't feel bad about drinking more of. It's also a pretty good value.,It's not a brand my friends drink and I typically drink what they do.,3,Coors Light,Miller light,Bud light,,1163,0
3046,24-10-2024 13:54,24-10-2024 14:08,30,2,5,11,1,0,0,0,0,0,1,1,0,1,0,1,0,0,0,5,5,5,4,5,5,9,"I wouldn’t want this, ever. It’s Terrible beer.",Everything. It’s not good.,1,,,,,1163,0
3052,24-10-2024 13:56,24-10-2024 14:10,55,1,5,11,1,0,0,0,0,0,1,0,0,1,0,0,0,1,0,5,5,5,4,5,5,9,I've not really tried it,Neither cause I have not drank it beefore,2,Bud light,Coors,Busch,,1163,0
3055,24-10-2024 13:43,24-10-2024 14:11,24,2,5,11,1,1,0,1,0,1,1,1,1,1,0,1,0,0,0,5,5,5,4,5,5,9,The brand and that it’s a an American made beer and it’s light I would wanna try it,"I didn’t dislike anything, the description could be more interesting",2,Cornona extra,Miller,,,1163,0
3059,24-10-2024 14:00,24-10-2024 14:12,53,2,5,11,1,0,0,0,0,0,0,0,0,0,0,0,1,0,0,5,5,5,4,5,5,9,The amount carbs,Nothing,1,,,,,1163,0
3082,24-10-2024 14:01,24-10-2024 14:19,53,1,5,11,1,1,0,1,0,1,1,1,1,1,0,1,1,0,0,5,5,5,4,5,5,9,Taste,Nothing,1,,,,,1163,0
3083,24-10-2024 14:09,24-10-2024 14:19,57,2,5,11,1,0,0,0,0,1,0,1,0,0,0,1,0,1,0,5,5,5,4,5,5,9,I wouldn’t drink it- I’ve had the other and it’s very watered down,To watered down,1,,,,,1163,0
3086,24-10-2024 14:09,24-10-2024 14:20,56,1,5,11,1,0,0,0,0,1,1,1,0,1,1,0,1,1,0,5,5,5,4,5,5,9,it has low carbs and calories,nothing,2,corona extra,none,none,,1163,0
3089,24-10-2024 13:54,24-10-2024 14:21,56,2,5,11,1,0,0,0,0,0,0,0,0,1,0,0,0,0,0,5,5,5,4,5,5,9,"I love everything about Michelob ULTRA Pure Gold, and I cannot wait to try it. I already LOVE regular Michelob ULTRA, and I love the idea of an organic beer. So this works well for me.",I dislike absolutely nothing.,2,BUSCH,BUSCH LIGHT,MICHELOB ULTRA,,1163,0
3090,24-10-2024 14:00,24-10-2024 14:21,24,2,5,11,1,1,0,1,0,1,1,0,1,1,1,1,0,0,0,5,5,5,4,5,5,9,I like the taste and the calorie intake,It's a little low quality,2,Bud light,Corona,Corona light,,1163,0
3092,24-10-2024 14:10,24-10-2024 14:22,58,2,5,11,1,1,0,0,0,1,1,1,1,1,0,1,0,1,0,5,5,5,4,5,5,9,I like the fact that it's low calorie but I'm not a fan of the organic stuff organic to me normally taste funny,Once again I'm not a fan of organic products haven't had a lot of luck with him in the past,1,,,,,1163,0
3093,24-10-2024 14:07,24-10-2024 14:22,63,2,5,11,1,0,0,0,0,0,0,1,1,1,0,0,0,0,0,5,5,5,4,5,5,9,I like that it’s American home grown ingredients,It’s one third less alcohol,1,,,,,1163,0
3100,24-10-2024 14:11,24-10-2024 14:24,65,2,5,11,1,0,0,1,0,1,0,1,0,1,1,0,1,1,0,5,5,5,4,5,5,9,The price and the color of the beer. Uses homegrown ingredients to make it,It’s too light of a beer. I want to taste the ale not water,1,,,,,1163,0
3106,24-10-2024 13:33,24-10-2024 14:25,34,1,5,11,1,1,1,1,1,1,1,1,1,1,1,1,1,1,1,5,5,5,4,5,5,9,12,none,1,,,,,1163,0
